Tender ID,tender_externalreference,tender_title,Work Description,Tender Category,Tender Type,Form of contract,Product Category,Is Multi Currency Allowed For BOQ,Allow Two Stage Bidding,Independent External Monitor/Remarks,Published Date,Pre Bid Meeting Date,Bid Validity(Days),Should Allow NDA Tender,Allow Preferential Bidder,Payment Mode,Bid Opening Date,Organisation Chain,location,Pincode,No of Bids Received,Tender Value in ₹,Bidder Name,Awarded Value,Status,Contract Date :,Tender Stage,Department,is_flood_tender,positive_keywords_dict,negative_keywords_dict,Season,Scheme
2021_BoTC_23823_1,TN 170 of 2021-22 - 170/1,"Establishment of i) 32/42 bedded Paediatrics Care Unit, ii) 10 bedded Intensive Care Unit, iii) RT PCR laboratory and iv) LMO tank with MGPS at District Hospital/SDCH in various districts of Assam under ECRP II","Establishment of i) 32/42 bedded Paediatrics Care Unit, ii) 10 bedded Intensive Care Unit, iii) RT PCR laboratory and iv) LMO tank with MGPS at District Hospital/SDCH in various districts of Assam under ECRP II (Renovation of existing ward into 12",Works,Open Tender,Works,Civil Works,No,No,NA ,24-Dec-2021 11:30 AM,NA ,90.0,No ,No,Offline,05-Jan-2022 03:30 PM,Bodoland Territorial Council||PWD-BTC,UDALGURI,784509.0,2.0,"1,88,09,736",Assam Air Products Pvt. Ltd.,25192416.0,Accepted-AOC,01-Mar-2022,AOC,Bodoland Territorial Council||PWD-BTC,True,"{'maternal': 0, 'maternity': 0, 'women': 0, 'maternity and child health': 0, 'newborn': 0, 'infant': 0, 'paediatric': 0, 'labor': 0, 'health': 0, 'hospital': 2, 'vaccine': 0, 'vaccination': 0, 'immunization': 0, 'immunisation': 0, 'cold chain': 0, 'ice lined refrigerator': 0, 'ILR': 0, 'deep freezer': 0, 'walk-in cooler': 0, 'walk-in freezer': 0, 'vaccine carrier': 0, 'cold box': 0, 'polio vaccine': 0, 'Universal immunization': 0, 'ASHA worker': 0, 'ASHA training': 0, 'ASHA incentive': 0, 'ASHA module': 0, 'community health volunteer': 0, 'field health worker training': 0, 'ASHA reporting tools': 0, 'JSY': 0, 'institutional delivery incentive': 0, 'cash incentive delivery': 0, 'referral transport pregnant women': 0, 'JSY beneficiary': 0, 'delivery incentive scheme': 0, 'JSSK': 0, 'free delivery': 0, 'free C-section': 0, 'free medicines pregnant women': 0, 'free diagnostics pregnant women': 0, 'free transport mother newborn': 0, 'diet provision pregnant women': 0, 'JSSK newborn package': 0, 'PMSMA clinic': 0, 'ANC check-up 9th of month': 0, 'PMSMA diagnostics': 0, 'specialist ANC camp': 0, 'pregnancy screening PMSMA': 0, 'LaQshya labour room': 0, 'labour room strengthening': 0, 'delivery room quality': 0, 'maternity OT upgradation': 0, 'LaQshya certification': 0, 'LaQshya facility improvement': 0, 'RBSK screening': 0, 'DEIC centre': 0, 'early intervention centre': 0, 'child screening 0-18 years': 0, 'birth defect screening': 0, 'RBSK mobile team': 0, 'Mission Indradhanush': 0, 'MI round': 0, 'left-out children vaccination': 0, 'dropout children vaccination': 0, 'immunization campaign outreach': 0, 'IMI immunization': 0, 'IMI drive': 0, 'high-risk area vaccination': 0, 'IMI microplan': 0, 'Poshan Abhiyaan': 0, 'nutrition monitoring': 0, 'growth monitoring devices': 0, 'ICT-RTM anganwadi': 0, 'nutrition rehabilitation': 0, 'malnutrition reduction': 0, 'PMMVY': 0, 'maternity benefit first child': 0, 'cash benefit pregnant women': 0, 'PMMVY payment system': 0, 'mother benefit scheme': 0, 'SUMAN maternity service': 0, 'respectful maternity care': 0, 'SUMAN certification': 0, 'zero expense delivery': 0, 'maternal newborn assured care': 0, 'MCTS': 0, 'mother child tracking': 0, 'MCTS portal': 0, 'digital ANC tracking': 0, 'digital PNC tracking': 0, 'immunization tracking system': 0, 'Mamoni scheme': 0, 'ANC nutrition assistance': 0, 'pregnant women nutrition cash': 0, 'Assam Mamoni': 0, 'Mamata kit': 0, 'newborn care kit': 0, 'mother kit distribution': 0, 'post-delivery kit': 0, 'Assam Mamata kit': 0, 'Sneha Sparsha': 0, 'financial aid child treatment': 0, 'specialized treatment child': 0, 'paediatric tertiary care support': 0, 'CHD scheme': 0, 'congenital heart surgery child': 0, 'paediatric cardiac surgery': 0, 'free heart surgery child': 0, 'Operation Smile': 0, 'cleft lip surgery': 0, 'cleft palate surgery': 0, 'free cleft surgery Assam': 0, 'Majoni scheme': 0, 'girl child security scheme': 0, 'Assam Majoni benefit': 0, 'Assam free diagnostics': 0, 'free maternal diagnostics': 0, 'free pregnancy tests': 0, 'free drugs pregnant women': 0, 'free lab tests Assam': 0, 'NMBS': 0, 'maternal nutritional benefit': 0, 'pregnant women cash support NMBS': 0, 'RCH programme': 0, 'maternal child health RCH': 0, 'RCH facility strengthening': 0, 'RCH Phase II': 0, 'NHM facility strengthening': 0, 'NRHM infrastructure': 0, 'CHC upgradation NHM': 0, 'PHC upgradation NHM': 0, 'district hospital MCH strengthening': 0}","{'Floodlight': 0, 'Flood Light': 0, 'GAS': 0, 'FIFA': 0, 'pipe': 0, 'pipes': 0, 'covid': 0}",Post-Monsoon,
2021_HFWD_23219_4,NO. SMEJ/JMCH/2571/2021/5383 Date.22/10/2021,"SUPPLY OF STATIONERY ITEMS ON RATE CONTRACT BASIS AT JORHAT MEDICAL COLLEGE AND HOSPITAL, JORHAT-ASSAM","SUPPLY OF STATIONERY ITEMS ON RATE CONTRACT BASIS AT JORHAT MEDICAL COLLEGE AND HOSPITAL, JORHAT-ASSAM",Goods,Open Tender,Supply,Stationery,No,No,NA ,16-Dec-2021 05:00 PM,NA ,365.0,No ,No,Online,28-Dec-2021 01:00 PM,Health and Family Welfare Department||Directorate of Medical Education-HFWD||Jorhat Medical College and Hospital-HFWD,"JORHAT MEDICAL COLLEGE AND HOSPITAL, JORHAT",785001.0,2.0,,M/S AAKHANSHA CONSTRICTION,1500000.0,Accepted-AOC,16-Mar-2022,AOC,Health and Family Welfare Department||Directorate of Medical Education-HFWD||Jorhat Medical College and Hospital-HFWD,True,"{'maternal': 0, 'maternity': 0, 'women': 0, 'maternity and child health': 0, 'newborn': 0, 'infant': 0, 'paediatric': 0, 'labor': 0, 'health': 0, 'hospital': 2, 'vaccine': 0, 'vaccination': 0, 'immunization': 0, 'immunisation': 0, 'cold chain': 0, 'ice lined refrigerator': 0, 'ILR': 0, 'deep freezer': 0, 'walk-in cooler': 0, 'walk-in freezer': 0, 'vaccine carrier': 0, 'cold box': 0, 'polio vaccine': 0, 'Universal immunization': 0, 'ASHA worker': 0, 'ASHA training': 0, 'ASHA incentive': 0, 'ASHA module': 0, 'community health volunteer': 0, 'field health worker training': 0, 'ASHA reporting tools': 0, 'JSY': 0, 'institutional delivery incentive': 0, 'cash incentive delivery': 0, 'referral transport pregnant women': 0, 'JSY beneficiary': 0, 'delivery incentive scheme': 0, 'JSSK': 0, 'free delivery': 0, 'free C-section': 0, 'free medicines pregnant women': 0, 'free diagnostics pregnant women': 0, 'free transport mother newborn': 0, 'diet provision pregnant women': 0, 'JSSK newborn package': 0, 'PMSMA clinic': 0, 'ANC check-up 9th of month': 0, 'PMSMA diagnostics': 0, 'specialist ANC camp': 0, 'pregnancy screening PMSMA': 0, 'LaQshya labour room': 0, 'labour room strengthening': 0, 'delivery room quality': 0, 'maternity OT upgradation': 0, 'LaQshya certification': 0, 'LaQshya facility improvement': 0, 'RBSK screening': 0, 'DEIC centre': 0, 'early intervention centre': 0, 'child screening 0-18 years': 0, 'birth defect screening': 0, 'RBSK mobile team': 0, 'Mission Indradhanush': 0, 'MI round': 0, 'left-out children vaccination': 0, 'dropout children vaccination': 0, 'immunization campaign outreach': 0, 'IMI immunization': 0, 'IMI drive': 0, 'high-risk area vaccination': 0, 'IMI microplan': 0, 'Poshan Abhiyaan': 0, 'nutrition monitoring': 0, 'growth monitoring devices': 0, 'ICT-RTM anganwadi': 0, 'nutrition rehabilitation': 0, 'malnutrition reduction': 0, 'PMMVY': 0, 'maternity benefit first child': 0, 'cash benefit pregnant women': 0, 'PMMVY payment system': 0, 'mother benefit scheme': 0, 'SUMAN maternity service': 0, 'respectful maternity care': 0, 'SUMAN certification': 0, 'zero expense delivery': 0, 'maternal newborn assured care': 0, 'MCTS': 0, 'mother child tracking': 0, 'MCTS portal': 0, 'digital ANC tracking': 0, 'digital PNC tracking': 0, 'immunization tracking system': 0, 'Mamoni scheme': 0, 'ANC nutrition assistance': 0, 'pregnant women nutrition cash': 0, 'Assam Mamoni': 0, 'Mamata kit': 0, 'newborn care kit': 0, 'mother kit distribution': 0, 'post-delivery kit': 0, 'Assam Mamata kit': 0, 'Sneha Sparsha': 0, 'financial aid child treatment': 0, 'specialized treatment child': 0, 'paediatric tertiary care support': 0, 'CHD scheme': 0, 'congenital heart surgery child': 0, 'paediatric cardiac surgery': 0, 'free heart surgery child': 0, 'Operation Smile': 0, 'cleft lip surgery': 0, 'cleft palate surgery': 0, 'free cleft surgery Assam': 0, 'Majoni scheme': 0, 'girl child security scheme': 0, 'Assam Majoni benefit': 0, 'Assam free diagnostics': 0, 'free maternal diagnostics': 0, 'free pregnancy tests': 0, 'free drugs pregnant women': 0, 'free lab tests Assam': 0, 'NMBS': 0, 'maternal nutritional benefit': 0, 'pregnant women cash support NMBS': 0, 'RCH programme': 0, 'maternal child health RCH': 0, 'RCH facility strengthening': 0, 'RCH Phase II': 0, 'NHM facility strengthening': 0, 'NRHM infrastructure': 0, 'CHC upgradation NHM': 0, 'PHC upgradation NHM': 0, 'district hospital MCH strengthening': 0}","{'Floodlight': 0, 'Flood Light': 0, 'GAS': 0, 'FIFA': 0, 'pipe': 0, 'pipes': 0, 'covid': 0}",Post-Monsoon,
2021_HFWD_23588_1,NO. SMEJ/JMCH/2585/2021/14570 Date. 01/12/2021,"SUPPLY OF HOSPITAL LINEN FOR JORHAT MEDICAL COLLEGE AND HOSPITAL, JORHAT ON RATE CONTRACT BASIS","SUPPLY OF HOSPITAL LINEN FOR JORHAT MEDICAL COLLEGE AND HOSPITAL, JORHAT ON RATE CONTRACT BASIS",Goods,Open Tender,Supply,Uniforms/Curtains/Clothes,No,No,NA ,06-Dec-2021 12:00 PM,09-Dec-2021 12:00 PM ,365.0,No ,No,Online,27-Dec-2021 01:00 PM,Health and Family Welfare Department||Directorate of Medical Education-HFWD||Jorhat Medical College and Hospital-HFWD,"JORHAT MEDICAL COLLEGE AND HOSPITAL, JORHAT",785001.0,2.0,,fine thread apparels,1000000.0,Accepted-AOC,28-Mar-2022,AOC,Health and Family Welfare Department||Directorate of Medical Education-HFWD||Jorhat Medical College and Hospital-HFWD,True,"{'maternal': 0, 'maternity': 0, 'women': 0, 'maternity and child health': 0, 'newborn': 0, 'infant': 0, 'paediatric': 0, 'labor': 0, 'health': 0, 'hospital': 4, 'vaccine': 0, 'vaccination': 0, 'immunization': 0, 'immunisation': 0, 'cold chain': 0, 'ice lined refrigerator': 0, 'ILR': 0, 'deep freezer': 0, 'walk-in cooler': 0, 'walk-in freezer': 0, 'vaccine carrier': 0, 'cold box': 0, 'polio vaccine': 0, 'Universal immunization': 0, 'ASHA worker': 0, 'ASHA training': 0, 'ASHA incentive': 0, 'ASHA module': 0, 'community health volunteer': 0, 'field health worker training': 0, 'ASHA reporting tools': 0, 'JSY': 0, 'institutional delivery incentive': 0, 'cash incentive delivery': 0, 'referral transport pregnant women': 0, 'JSY beneficiary': 0, 'delivery incentive scheme': 0, 'JSSK': 0, 'free delivery': 0, 'free C-section': 0, 'free medicines pregnant women': 0, 'free diagnostics pregnant women': 0, 'free transport mother newborn': 0, 'diet provision pregnant women': 0, 'JSSK newborn package': 0, 'PMSMA clinic': 0, 'ANC check-up 9th of month': 0, 'PMSMA diagnostics': 0, 'specialist ANC camp': 0, 'pregnancy screening PMSMA': 0, 'LaQshya labour room': 0, 'labour room strengthening': 0, 'delivery room quality': 0, 'maternity OT upgradation': 0, 'LaQshya certification': 0, 'LaQshya facility improvement': 0, 'RBSK screening': 0, 'DEIC centre': 0, 'early intervention centre': 0, 'child screening 0-18 years': 0, 'birth defect screening': 0, 'RBSK mobile team': 0, 'Mission Indradhanush': 0, 'MI round': 0, 'left-out children vaccination': 0, 'dropout children vaccination': 0, 'immunization campaign outreach': 0, 'IMI immunization': 0, 'IMI drive': 0, 'high-risk area vaccination': 0, 'IMI microplan': 0, 'Poshan Abhiyaan': 0, 'nutrition monitoring': 0, 'growth monitoring devices': 0, 'ICT-RTM anganwadi': 0, 'nutrition rehabilitation': 0, 'malnutrition reduction': 0, 'PMMVY': 0, 'maternity benefit first child': 0, 'cash benefit pregnant women': 0, 'PMMVY payment system': 0, 'mother benefit scheme': 0, 'SUMAN maternity service': 0, 'respectful maternity care': 0, 'SUMAN certification': 0, 'zero expense delivery': 0, 'maternal newborn assured care': 0, 'MCTS': 0, 'mother child tracking': 0, 'MCTS portal': 0, 'digital ANC tracking': 0, 'digital PNC tracking': 0, 'immunization tracking system': 0, 'Mamoni scheme': 0, 'ANC nutrition assistance': 0, 'pregnant women nutrition cash': 0, 'Assam Mamoni': 0, 'Mamata kit': 0, 'newborn care kit': 0, 'mother kit distribution': 0, 'post-delivery kit': 0, 'Assam Mamata kit': 0, 'Sneha Sparsha': 0, 'financial aid child treatment': 0, 'specialized treatment child': 0, 'paediatric tertiary care support': 0, 'CHD scheme': 0, 'congenital heart surgery child': 0, 'paediatric cardiac surgery': 0, 'free heart surgery child': 0, 'Operation Smile': 0, 'cleft lip surgery': 0, 'cleft palate surgery': 0, 'free cleft surgery Assam': 0, 'Majoni scheme': 0, 'girl child security scheme': 0, 'Assam Majoni benefit': 0, 'Assam free diagnostics': 0, 'free maternal diagnostics': 0, 'free pregnancy tests': 0, 'free drugs pregnant women': 0, 'free lab tests Assam': 0, 'NMBS': 0, 'maternal nutritional benefit': 0, 'pregnant women cash support NMBS': 0, 'RCH programme': 0, 'maternal child health RCH': 0, 'RCH facility strengthening': 0, 'RCH Phase II': 0, 'NHM facility strengthening': 0, 'NRHM infrastructure': 0, 'CHC upgradation NHM': 0, 'PHC upgradation NHM': 0, 'district hospital MCH strengthening': 0}","{'Floodlight': 0, 'Flood Light': 0, 'GAS': 0, 'FIFA': 0, 'pipe': 0, 'pipes': 0, 'covid': 0}",Post-Monsoon,
2021_NHM_22097_3,NHM/32050/14/2020-Cons/229 dt22-06-21,"Repairing Renovation of Sub Centres to upgrade them as Health Wellness Centres at various places of Assam 185 nos of Balance HWC from RoP 2019 -20 GROUP-3, 8 Nos. of scheme in Barpeta District","Repairing Renovation of Sub Centres to upgrade them as Health Wellness Centres at various places of Assam 185 nos of Balance HWC from RoP 2019 -20 GROUP-3, 8 Nos. of scheme in Barpeta District",Works,Open Tender,Item Rate,Civil Works,No,No,NA ,05-Jul-2021 09:00 AM,NA ,180.0,No ,No,Offline,07-Aug-2021 02:30 PM,National Health Mission||State Programme Management Unit - NHM,BARPETA,781301.0,2.0,"53,91,977",Debananda Bharali,5176298.0,Accepted-AOC,27-Mar-2022,AOC,National Health Mission||State Programme Management Unit - NHM,True,"{'maternal': 0, 'maternity': 0, 'women': 0, 'maternity and child health': 0, 'newborn': 0, 'infant': 0, 'paediatric': 0, 'labor': 0, 'health': 2, 'hospital': 0, 'vaccine': 0, 'vaccination': 0, 'immunization': 0, 'immunisation': 0, 'cold chain': 0, 'ice lined refrigerator': 0, 'ILR': 0, 'deep freezer': 0, 'walk-in cooler': 0, 'walk-in freezer': 0, 'vaccine carrier': 0, 'cold box': 0, 'polio vaccine': 0, 'Universal immunization': 0, 'ASHA worker': 0, 'ASHA training': 0, 'ASHA incentive': 0, 'ASHA module': 0, 'community health volunteer': 0, 'field health worker training': 0, 'ASHA reporting tools': 0, 'JSY': 0, 'institutional delivery incentive': 0, 'cash incentive delivery': 0, 'referral transport pregnant women': 0, 'JSY beneficiary': 0, 'delivery incentive scheme': 0, 'JSSK': 0, 'free delivery': 0, 'free C-section': 0, 'free medicines pregnant women': 0, 'free diagnostics pregnant women': 0, 'free transport mother newborn': 0, 'diet provision pregnant women': 0, 'JSSK newborn package': 0, 'PMSMA clinic': 0, 'ANC check-up 9th of month': 0, 'PMSMA diagnostics': 0, 'specialist ANC camp': 0, 'pregnancy screening PMSMA': 0, 'LaQshya labour room': 0, 'labour room strengthening': 0, 'delivery room quality': 0, 'maternity OT upgradation': 0, 'LaQshya certification': 0, 'LaQshya facility improvement': 0, 'RBSK screening': 0, 'DEIC centre': 0, 'early intervention centre': 0, 'child screening 0-18 years': 0, 'birth defect screening': 0, 'RBSK mobile team': 0, 'Mission Indradhanush': 0, 'MI round': 0, 'left-out children vaccination': 0, 'dropout children vaccination': 0, 'immunization campaign outreach': 0, 'IMI immunization': 0, 'IMI drive': 0, 'high-risk area vaccination': 0, 'IMI microplan': 0, 'Poshan Abhiyaan': 0, 'nutrition monitoring': 0, 'growth monitoring devices': 0, 'ICT-RTM anganwadi': 0, 'nutrition rehabilitation': 0, 'malnutrition reduction': 0, 'PMMVY': 0, 'maternity benefit first child': 0, 'cash benefit pregnant women': 0, 'PMMVY payment system': 0, 'mother benefit scheme': 0, 'SUMAN maternity service': 0, 'respectful maternity care': 0, 'SUMAN certification': 0, 'zero expense delivery': 0, 'maternal newborn assured care': 0, 'MCTS': 0, 'mother child tracking': 0, 'MCTS portal': 0, 'digital ANC tracking': 0, 'digital PNC tracking': 0, 'immunization tracking system': 0, 'Mamoni scheme': 0, 'ANC nutrition assistance': 0, 'pregnant women nutrition cash': 0, 'Assam Mamoni': 0, 'Mamata kit': 0, 'newborn care kit': 0, 'mother kit distribution': 0, 'post-delivery kit': 0, 'Assam Mamata kit': 0, 'Sneha Sparsha': 0, 'financial aid child treatment': 0, 'specialized treatment child': 0, 'paediatric tertiary care support': 0, 'CHD scheme': 0, 'congenital heart surgery child': 0, 'paediatric cardiac surgery': 0, 'free heart surgery child': 0, 'Operation Smile': 0, 'cleft lip surgery': 0, 'cleft palate surgery': 0, 'free cleft surgery Assam': 0, 'Majoni scheme': 0, 'girl child security scheme': 0, 'Assam Majoni benefit': 0, 'Assam free diagnostics': 0, 'free maternal diagnostics': 0, 'free pregnancy tests': 0, 'free drugs pregnant women': 0, 'free lab tests Assam': 0, 'NMBS': 0, 'maternal nutritional benefit': 0, 'pregnant women cash support NMBS': 0, 'RCH programme': 0, 'maternal child health RCH': 0, 'RCH facility strengthening': 0, 'RCH Phase II': 0, 'NHM facility strengthening': 0, 'NRHM infrastructure': 0, 'CHC upgradation NHM': 0, 'PHC upgradation NHM': 0, 'district hospital MCH strengthening': 0}","{'Floodlight': 0, 'Flood Light': 0, 'GAS': 0, 'FIFA': 0, 'pipe': 0, 'pipes': 0, 'covid': 0}",Monsoon,NHM
2021_NHM_22154_1,NHM/C-CW/32050/15/2020-Cons/51,"Repairing Renovation of 210 Nos of Subcentres to upgrade them as Health and Wellness Centres Pkg No. NHM/HWC/SC/Grp-1, 8 nos in Baksa District","Repairing Repairing Renovation of 210 Nos of Subcentres to upgrade them as Health and Wellness Centres Pkg No. NHM/HWC/SC/Grp-1, 8 nos in Baksa District",Works,Open Tender,Item Rate,Civil Works,No,No,NA ,12-Jul-2021 12:00 PM,NA ,180.0,No ,No,Offline,05-Aug-2021 02:30 PM,National Health Mission||State Programme Management Unit - NHM,Baksa,781372.0,2.0,"47,77,332",MAYUR TALUKDAR,4299616.0,Accepted-AOC,29-Mar-2022,AOC,National Health Mission||State Programme Management Unit - NHM,True,"{'maternal': 0, 'maternity': 0, 'women': 0, 'maternity and child health': 0, 'newborn': 0, 'infant': 0, 'paediatric': 0, 'labor': 0, 'health': 2, 'hospital': 0, 'vaccine': 0, 'vaccination': 0, 'immunization': 0, 'immunisation': 0, 'cold chain': 0, 'ice lined refrigerator': 0, 'ILR': 0, 'deep freezer': 0, 'walk-in cooler': 0, 'walk-in freezer': 0, 'vaccine carrier': 0, 'cold box': 0, 'polio vaccine': 0, 'Universal immunization': 0, 'ASHA worker': 0, 'ASHA training': 0, 'ASHA incentive': 0, 'ASHA module': 0, 'community health volunteer': 0, 'field health worker training': 0, 'ASHA reporting tools': 0, 'JSY': 0, 'institutional delivery incentive': 0, 'cash incentive delivery': 0, 'referral transport pregnant women': 0, 'JSY beneficiary': 0, 'delivery incentive scheme': 0, 'JSSK': 0, 'free delivery': 0, 'free C-section': 0, 'free medicines pregnant women': 0, 'free diagnostics pregnant women': 0, 'free transport mother newborn': 0, 'diet provision pregnant women': 0, 'JSSK newborn package': 0, 'PMSMA clinic': 0, 'ANC check-up 9th of month': 0, 'PMSMA diagnostics': 0, 'specialist ANC camp': 0, 'pregnancy screening PMSMA': 0, 'LaQshya labour room': 0, 'labour room strengthening': 0, 'delivery room quality': 0, 'maternity OT upgradation': 0, 'LaQshya certification': 0, 'LaQshya facility improvement': 0, 'RBSK screening': 0, 'DEIC centre': 0, 'early intervention centre': 0, 'child screening 0-18 years': 0, 'birth defect screening': 0, 'RBSK mobile team': 0, 'Mission Indradhanush': 0, 'MI round': 0, 'left-out children vaccination': 0, 'dropout children vaccination': 0, 'immunization campaign outreach': 0, 'IMI immunization': 0, 'IMI drive': 0, 'high-risk area vaccination': 0, 'IMI microplan': 0, 'Poshan Abhiyaan': 0, 'nutrition monitoring': 0, 'growth monitoring devices': 0, 'ICT-RTM anganwadi': 0, 'nutrition rehabilitation': 0, 'malnutrition reduction': 0, 'PMMVY': 0, 'maternity benefit first child': 0, 'cash benefit pregnant women': 0, 'PMMVY payment system': 0, 'mother benefit scheme': 0, 'SUMAN maternity service': 0, 'respectful maternity care': 0, 'SUMAN certification': 0, 'zero expense delivery': 0, 'maternal newborn assured care': 0, 'MCTS': 0, 'mother child tracking': 0, 'MCTS portal': 0, 'digital ANC tracking': 0, 'digital PNC tracking': 0, 'immunization tracking system': 0, 'Mamoni scheme': 0, 'ANC nutrition assistance': 0, 'pregnant women nutrition cash': 0, 'Assam Mamoni': 0, 'Mamata kit': 0, 'newborn care kit': 0, 'mother kit distribution': 0, 'post-delivery kit': 0, 'Assam Mamata kit': 0, 'Sneha Sparsha': 0, 'financial aid child treatment': 0, 'specialized treatment child': 0, 'paediatric tertiary care support': 0, 'CHD scheme': 0, 'congenital heart surgery child': 0, 'paediatric cardiac surgery': 0, 'free heart surgery child': 0, 'Operation Smile': 0, 'cleft lip surgery': 0, 'cleft palate surgery': 0, 'free cleft surgery Assam': 0, 'Majoni scheme': 0, 'girl child security scheme': 0, 'Assam Majoni benefit': 0, 'Assam free diagnostics': 0, 'free maternal diagnostics': 0, 'free pregnancy tests': 0, 'free drugs pregnant women': 0, 'free lab tests Assam': 0, 'NMBS': 0, 'maternal nutritional benefit': 0, 'pregnant women cash support NMBS': 0, 'RCH programme': 0, 'maternal child health RCH': 0, 'RCH facility strengthening': 0, 'RCH Phase II': 0, 'NHM facility strengthening': 0, 'NRHM infrastructure': 0, 'CHC upgradation NHM': 0, 'PHC upgradation NHM': 0, 'district hospital MCH strengthening': 0}","{'Floodlight': 0, 'Flood Light': 0, 'GAS': 0, 'FIFA': 0, 'pipe': 0, 'pipes': 0, 'covid': 0}",Monsoon,NHM
