Tender ID,tender_externalreference,tender_title,Work Description,Tender Category,Tender Type,Form of contract,Product Category,Is Multi Currency Allowed For BOQ,Allow Two Stage Bidding,Independent External Monitor/Remarks,Published Date,Pre Bid Meeting Date,Bid Validity(Days),Should Allow NDA Tender,Allow Preferential Bidder,Payment Mode,Bid Opening Date,Organisation Chain,location,Pincode,No of Bids Received,Tender Value in ₹,Bidder Name,Awarded Value,Status,Contract Date :,Department,is_mch_tender,positive_keywords_dict,negative_keywords_dict,Season,Scheme
2023_NHM_31156_28,NHM-32023/11/2022-Cons-NHM/152,Construction of Buildingless Sub Health Centre at BAKARI GAON SC in Sonitpur District under PM ABHIM for the FY 2021 22 under NHM Assam on Turn Key Basis.,Construction of Buildingless Sub Health Centre at BAKARI GAON SC in Sonitpur District under PM ABHIM for the FY 2021 22 under NHM Assam on Turn Key Basis.,Works,Open Tender,Turn-key,Civil Works - Building,No,No,NA ,12-Jun-2023 12:10 PM,NA ,180.0,No ,No,Online,05-Jul-2023 03:30 PM,National Health Mission||State Programme Management Unit - NHM,Sonitpur,782123.0,2.0,"52,03,000",M/S BHARVIKA INFRASTRUCTURE,"5,124,955",Accepted-AOC,15-Jun-2024,National Health Mission||State Programme Management Unit - NHM,True,"{'maternal': 0, 'maternity': 0, 'mother and child': 0, 'maternity and child health': 0, 'pregnant woman': 0, 'pregnant women': 0, 'pregnancy care': 0, 'institutional delivery': 0, 'labour room': 0, 'labor room': 0, 'labour ward': 0, 'maternity ward': 0, 'newborn': 0, 'neonatal': 0, 'infant': 0, 'nicu': 0, 'sncu': 0, 'child health': 0, 'paediatric': 0, 'pediatric': 0, 'antenatal care': 0, 'antenatal clinic': 0, 'anc check-up': 0, 'anc clinic': 0, 'postnatal care': 0, 'pnc visit': 0, 'immunization': 0, 'immunisation': 0, 'vaccination': 0, 'vaccine': 0, 'cold chain': 0, 'ice lined refrigerator': 0, 'ilr': 0, 'deep freezer': 0, 'vaccine carrier': 0, 'cold box': 0, 'nutrition rehabilitation': 0, 'growth monitoring': 0, 'malnutrition reduction': 0, 'anganwadi centre': 0, 'anganwadi center': 0, 'icds centre': 0, 'icds center': 0, 'jssk': 0, 'samahar kit': 0, 'poshan': 0, 'rbsk': 0, 'rch register': 0, 'rch programme': 0, 'nhm': 4, 'nrhm': 0, 'mamoni': 0, 'asha worker': 0, 'asha training': 0, 'asha incentive': 0, 'janani suraksha yojana': 0, 'jsy': 0, 'janani shishu suraksha karyakram': 0, 'pmsma': 0, 'mission indradhanush': 0, 'intensified mission indradhanush': 0, 'poshan abhiyaan': 0, 'pmmvy': 0, 'suman programme': 0, 'suman maternity': 0, 'mcts': 0, 'mamata kit': 0, 'sneha sparsha': 0, 'congenital heart disease scheme': 0, 'operation smile': 0, 'majoni scheme': 0, 'assam free diagnostics': 0, 'national maternity benefit scheme': 0, 'rch': 0}",{},Monsoon,NHM
2023_NHM_31531_1,NHM/37025/2/2023-NCD/5528,BID FROM ELIGIBLE FIRMS/AGENCIES TO IMPLEMENT VILLAGE,BID FROM ELIGIBLE FIRMS/AGENCIES TO IMPLEMENT VILLAGE HEALTH OUTREACH PROGRAMME IN RURAL AREAS OF ASSAM,Services,Open Tender,EOI,Miscellaneous Services,No,No,NA ,07-Jul-2023 10:00 AM,14-Jul-2023 04:00 PM ,120.0,No ,No,Online,05-Aug-2023 04:00 PM,National Health Mission||State Programme Management Unit - NHM,NHM SHQ,781005.0,2.0,,Piramal Swasthya Management and Research Institute,"130,070,400",Accepted-AOC,28-Jun-2024,National Health Mission||State Programme Management Unit - NHM,True,"{'maternal': 0, 'maternity': 0, 'mother and child': 0, 'maternity and child health': 0, 'pregnant woman': 0, 'pregnant women': 0, 'pregnancy care': 0, 'institutional delivery': 0, 'labour room': 0, 'labor room': 0, 'labour ward': 0, 'maternity ward': 0, 'newborn': 0, 'neonatal': 0, 'infant': 0, 'nicu': 0, 'sncu': 0, 'child health': 0, 'paediatric': 0, 'pediatric': 0, 'antenatal care': 0, 'antenatal clinic': 0, 'anc check-up': 0, 'anc clinic': 0, 'postnatal care': 0, 'pnc visit': 0, 'immunization': 0, 'immunisation': 0, 'vaccination': 0, 'vaccine': 0, 'cold chain': 0, 'ice lined refrigerator': 0, 'ilr': 0, 'deep freezer': 0, 'vaccine carrier': 0, 'cold box': 0, 'nutrition rehabilitation': 0, 'growth monitoring': 0, 'malnutrition reduction': 0, 'anganwadi centre': 0, 'anganwadi center': 0, 'icds centre': 0, 'icds center': 0, 'jssk': 0, 'samahar kit': 0, 'poshan': 0, 'rbsk': 0, 'rch register': 0, 'rch programme': 0, 'nhm': 1, 'nrhm': 0, 'mamoni': 0, 'asha worker': 0, 'asha training': 0, 'asha incentive': 0, 'janani suraksha yojana': 0, 'jsy': 0, 'janani shishu suraksha karyakram': 0, 'pmsma': 0, 'mission indradhanush': 0, 'intensified mission indradhanush': 0, 'poshan abhiyaan': 0, 'pmmvy': 0, 'suman programme': 0, 'suman maternity': 0, 'mcts': 0, 'mamata kit': 0, 'sneha sparsha': 0, 'congenital heart disease scheme': 0, 'operation smile': 0, 'majoni scheme': 0, 'assam free diagnostics': 0, 'national maternity benefit scheme': 0, 'rch': 0}",{},Monsoon,NHM
2023_NHM_31602_11,NHM-32023/469/2022-CONS-NHM/92,Construction of Buildingless Sub Health Centre in Kashinathpur SC in Karimganj District for FY 2022 23 under PM AHBIM on Turnkey Basis,Construction of Buildingless Sub Health Centre in Kashinathpur SC in Karimganj District for FY 2022 23 under PM AHBIM on Turnkey Basis,Works,Open Tender,Turn-key,Civil Works - Building,No,No,NA ,10-Jul-2023 05:00 PM,NA ,180.0,No ,No,Online,29-Jul-2023 03:30 PM,National Health Mission||State Programme Management Unit - NHM,Karimganj,788710.0,2.0,"52,03,000",SATYAJIT PAUL,"5,150,970",Accepted-AOC,28-Jun-2024,National Health Mission||State Programme Management Unit - NHM,True,"{'maternal': 0, 'maternity': 0, 'mother and child': 0, 'maternity and child health': 0, 'pregnant woman': 0, 'pregnant women': 0, 'pregnancy care': 0, 'institutional delivery': 0, 'labour room': 0, 'labor room': 0, 'labour ward': 0, 'maternity ward': 0, 'newborn': 0, 'neonatal': 0, 'infant': 0, 'nicu': 0, 'sncu': 0, 'child health': 0, 'paediatric': 0, 'pediatric': 0, 'antenatal care': 0, 'antenatal clinic': 0, 'anc check-up': 0, 'anc clinic': 0, 'postnatal care': 0, 'pnc visit': 0, 'immunization': 0, 'immunisation': 0, 'vaccination': 0, 'vaccine': 0, 'cold chain': 0, 'ice lined refrigerator': 0, 'ilr': 0, 'deep freezer': 0, 'vaccine carrier': 0, 'cold box': 0, 'nutrition rehabilitation': 0, 'growth monitoring': 0, 'malnutrition reduction': 0, 'anganwadi centre': 0, 'anganwadi center': 0, 'icds centre': 0, 'icds center': 0, 'jssk': 0, 'samahar kit': 0, 'poshan': 0, 'rbsk': 0, 'rch register': 0, 'rch programme': 0, 'nhm': 2, 'nrhm': 0, 'mamoni': 0, 'asha worker': 0, 'asha training': 0, 'asha incentive': 0, 'janani suraksha yojana': 0, 'jsy': 0, 'janani shishu suraksha karyakram': 0, 'pmsma': 0, 'mission indradhanush': 0, 'intensified mission indradhanush': 0, 'poshan abhiyaan': 0, 'pmmvy': 0, 'suman programme': 0, 'suman maternity': 0, 'mcts': 0, 'mamata kit': 0, 'sneha sparsha': 0, 'congenital heart disease scheme': 0, 'operation smile': 0, 'majoni scheme': 0, 'assam free diagnostics': 0, 'national maternity benefit scheme': 0, 'rch': 0}",{},Monsoon,NHM
2023_NHM_31823_14,32034/17/2023-Const-NHM/371,Construction of Buildingless Sub-Health Centres at various places of Assam under PM-ABHIM for FY 2022-23 48 nos.of Buildingless Sub-health Centres under NHM on Turnkey Basis. At DIYUNGMUKH FW SC in Dima Hasao District,Construction of Buildingless Sub-Health Centres at various places of Assam under PM-ABHIM for FY 2022-23 48 nos.of Buildingless Sub-health Centres under NHM on Turnkey Basis. At DIYUNGMUKH FW SC in Dima Hasao District,Works,Open Tender,Turn-key,Civil Works - Building,No,No,NA ,31-Jul-2023 12:00 PM,NA ,180.0,No ,No,Online,22-Aug-2023 03:30 PM,National Health Mission||State Programme Management Unit - NHM,Dima Hasao,788819.0,2.0,"52,03,000",BICHANON BATHARI,,Accepted-AOC,,National Health Mission||State Programme Management Unit - NHM,True,"{'maternal': 0, 'maternity': 0, 'mother and child': 0, 'maternity and child health': 0, 'pregnant woman': 0, 'pregnant women': 0, 'pregnancy care': 0, 'institutional delivery': 0, 'labour room': 0, 'labor room': 0, 'labour ward': 0, 'maternity ward': 0, 'newborn': 0, 'neonatal': 0, 'infant': 0, 'nicu': 0, 'sncu': 0, 'child health': 0, 'paediatric': 0, 'pediatric': 0, 'antenatal care': 0, 'antenatal clinic': 0, 'anc check-up': 0, 'anc clinic': 0, 'postnatal care': 0, 'pnc visit': 0, 'immunization': 0, 'immunisation': 0, 'vaccination': 0, 'vaccine': 0, 'cold chain': 0, 'ice lined refrigerator': 0, 'ilr': 0, 'deep freezer': 0, 'vaccine carrier': 0, 'cold box': 0, 'nutrition rehabilitation': 0, 'growth monitoring': 0, 'malnutrition reduction': 0, 'anganwadi centre': 0, 'anganwadi center': 0, 'icds centre': 0, 'icds center': 0, 'jssk': 0, 'samahar kit': 0, 'poshan': 0, 'rbsk': 0, 'rch register': 0, 'rch programme': 0, 'nhm': 3, 'nrhm': 0, 'mamoni': 0, 'asha worker': 0, 'asha training': 0, 'asha incentive': 0, 'janani suraksha yojana': 0, 'jsy': 0, 'janani shishu suraksha karyakram': 0, 'pmsma': 0, 'mission indradhanush': 0, 'intensified mission indradhanush': 0, 'poshan abhiyaan': 0, 'pmmvy': 0, 'suman programme': 0, 'suman maternity': 0, 'mcts': 0, 'mamata kit': 0, 'sneha sparsha': 0, 'congenital heart disease scheme': 0, 'operation smile': 0, 'majoni scheme': 0, 'assam free diagnostics': 0, 'national maternity benefit scheme': 0, 'rch': 0}",{},Monsoon,HFW;NHM
2023_NHM_32107_1,NHM-32034/304/2023-Const-NHM,Construction of Buildingless Sub Health Centre in Jamuhandal SC in Hojai District under PM ABHIM for the FY 2021 22 under NHM on Turnkey Basis,Construction of Buildingless Sub Health Centre in Jamuhandal SC in Hojai District under PM ABHIM for the FY 2021 22 under NHM on Turnkey Basis,Works,Open Tender,Turn-key,Civil Works - Building,No,No,NA ,17-Aug-2023 03:00 PM,NA ,180.0,No ,No,Online,02-Sep-2023 03:30 PM,National Health Mission||State Programme Management Unit - NHM,HOJAI,782435.0,2.0,"52,03,000",S.B. ENTERPRISE,"5,192,594",Accepted-AOC,28-Jun-2024,National Health Mission||State Programme Management Unit - NHM,True,"{'maternal': 0, 'maternity': 0, 'mother and child': 0, 'maternity and child health': 0, 'pregnant woman': 0, 'pregnant women': 0, 'pregnancy care': 0, 'institutional delivery': 0, 'labour room': 0, 'labor room': 0, 'labour ward': 0, 'maternity ward': 0, 'newborn': 0, 'neonatal': 0, 'infant': 0, 'nicu': 0, 'sncu': 0, 'child health': 0, 'paediatric': 0, 'pediatric': 0, 'antenatal care': 0, 'antenatal clinic': 0, 'anc check-up': 0, 'anc clinic': 0, 'postnatal care': 0, 'pnc visit': 0, 'immunization': 0, 'immunisation': 0, 'vaccination': 0, 'vaccine': 0, 'cold chain': 0, 'ice lined refrigerator': 0, 'ilr': 0, 'deep freezer': 0, 'vaccine carrier': 0, 'cold box': 0, 'nutrition rehabilitation': 0, 'growth monitoring': 0, 'malnutrition reduction': 0, 'anganwadi centre': 0, 'anganwadi center': 0, 'icds centre': 0, 'icds center': 0, 'jssk': 0, 'samahar kit': 0, 'poshan': 0, 'rbsk': 0, 'rch register': 0, 'rch programme': 0, 'nhm': 4, 'nrhm': 0, 'mamoni': 0, 'asha worker': 0, 'asha training': 0, 'asha incentive': 0, 'janani suraksha yojana': 0, 'jsy': 0, 'janani shishu suraksha karyakram': 0, 'pmsma': 0, 'mission indradhanush': 0, 'intensified mission indradhanush': 0, 'poshan abhiyaan': 0, 'pmmvy': 0, 'suman programme': 0, 'suman maternity': 0, 'mcts': 0, 'mamata kit': 0, 'sneha sparsha': 0, 'congenital heart disease scheme': 0, 'operation smile': 0, 'majoni scheme': 0, 'assam free diagnostics': 0, 'national maternity benefit scheme': 0, 'rch': 0}",{},Monsoon,NHM
2024_PWBNH_36804_1,SE/BII_OPD_SNCU_GMCH_MusQan,"Renovation and Up-gradation of Paediatric OPD, Wards, SNCU under MusQan at Gauhati Medical College Hospital Complex, Guwahati-32","Renovation and Up-gradation of Paediatric OPD, Wards, SNCU under MusQan at Gauhati Medical College Hospital Complex, Guwahati-32",Works,Open Tender,Item Wise,Civil Works - Building,No,No,NA ,02-Mar-2024 09:00 AM,04-Mar-2024 12:00 PM ,180.0,No ,No,Online,22-Mar-2024 04:30 PM,Public Works Building and NH Department||Chief Engineer-Building - PWBNH||SE-Guwahati Circle-2 - PWBNH,GMCH Guawahti,781032.0,2.0,"24,99,979",Karabi Bora Devi,"2,499,979",Accepted-AOC,26-Jun-2024,Public Works Building and NH Department||Chief Engineer-Building - PWBNH||SE-Guwahati Circle-2 - PWBNH,True,"{'maternal': 0, 'maternity': 0, 'mother and child': 0, 'maternity and child health': 0, 'pregnant woman': 0, 'pregnant women': 0, 'pregnancy care': 0, 'institutional delivery': 0, 'labour room': 0, 'labor room': 0, 'labour ward': 0, 'maternity ward': 0, 'newborn': 0, 'neonatal': 0, 'infant': 0, 'nicu': 0, 'sncu': 3, 'child health': 0, 'paediatric': 2, 'pediatric': 0, 'antenatal care': 0, 'antenatal clinic': 0, 'anc check-up': 0, 'anc clinic': 0, 'postnatal care': 0, 'pnc visit': 0, 'immunization': 0, 'immunisation': 0, 'vaccination': 0, 'vaccine': 0, 'cold chain': 0, 'ice lined refrigerator': 0, 'ilr': 0, 'deep freezer': 0, 'vaccine carrier': 0, 'cold box': 0, 'nutrition rehabilitation': 0, 'growth monitoring': 0, 'malnutrition reduction': 0, 'anganwadi centre': 0, 'anganwadi center': 0, 'icds centre': 0, 'icds center': 0, 'jssk': 0, 'samahar kit': 0, 'poshan': 0, 'rbsk': 0, 'rch register': 0, 'rch programme': 0, 'nhm': 0, 'nrhm': 0, 'mamoni': 0, 'asha worker': 0, 'asha training': 0, 'asha incentive': 0, 'janani suraksha yojana': 0, 'jsy': 0, 'janani shishu suraksha karyakram': 0, 'pmsma': 0, 'mission indradhanush': 0, 'intensified mission indradhanush': 0, 'poshan abhiyaan': 0, 'pmmvy': 0, 'suman programme': 0, 'suman maternity': 0, 'mcts': 0, 'mamata kit': 0, 'sneha sparsha': 0, 'congenital heart disease scheme': 0, 'operation smile': 0, 'majoni scheme': 0, 'assam free diagnostics': 0, 'national maternity benefit scheme': 0, 'rch': 0}",{},Pre-Monsoon,
