Tender ID,tender_externalreference,tender_title,Work Description,Tender Category,Tender Type,Form of contract,Product Category,Is Multi Currency Allowed For BOQ,Allow Two Stage Bidding,Independent External Monitor/Remarks,Published Date,Pre Bid Meeting Date,Bid Validity(Days),Should Allow NDA Tender,Allow Preferential Bidder,Payment Mode,Bid Opening Date,Organisation Chain,location,Pincode,No of Bids Received,Tender Value in ₹,Bidder Name,Awarded Value,Status,Contract Date :,Department,is_mch_tender,positive_keywords_dict,negative_keywords_dict,Season,Scheme
2023_NHM_31156_9,NHM-32023/11/2022-Cons-NHM/152,Construction of Buildingless Sub Health Centre at PATAKATA SC in Dhubri District under PM ABHIM for the FY 2021 22 under NHM Assam on Turn Key Basis.,Construction of Buildingless Sub Health Centre at PATAKATA SC in Dhubri District under PM ABHIM for the FY 2021 22 under NHM Assam on Turn Key Basis.,Works,Open Tender,Turn-key,Civil Works - Building,No,No,NA ,12-Jun-2023 11:00 AM,NA ,180.0,No ,No,Online,05-Jul-2023 03:30 PM,National Health Mission||State Programme Management Unit - NHM,Dhubri,783301.0,2.0,"52,03,000",ALTAB HOSSAON,"4,682,700",Accepted-AOC,19-Nov-2024,National Health Mission||State Programme Management Unit - NHM,True,"{'maternal': 0, 'maternity': 0, 'mother and child': 0, 'maternity and child health': 0, 'pregnant woman': 0, 'pregnant women': 0, 'pregnancy care': 0, 'institutional delivery': 0, 'labour room': 0, 'labor room': 0, 'labour ward': 0, 'maternity ward': 0, 'newborn': 0, 'neonatal': 0, 'infant': 0, 'nicu': 0, 'sncu': 0, 'child health': 0, 'paediatric': 0, 'pediatric': 0, 'antenatal care': 0, 'antenatal clinic': 0, 'anc check-up': 0, 'anc clinic': 0, 'postnatal care': 0, 'pnc visit': 0, 'immunization': 0, 'immunisation': 0, 'vaccination': 0, 'vaccine': 0, 'cold chain': 0, 'ice lined refrigerator': 0, 'ilr': 0, 'deep freezer': 0, 'vaccine carrier': 0, 'cold box': 0, 'nutrition rehabilitation': 0, 'growth monitoring': 0, 'malnutrition reduction': 0, 'anganwadi centre': 0, 'anganwadi center': 0, 'icds centre': 0, 'icds center': 0, 'jssk': 0, 'samahar kit': 0, 'poshan': 0, 'rbsk': 0, 'rch register': 0, 'rch programme': 0, 'nhm': 4, 'nrhm': 0, 'mamoni': 0, 'asha worker': 0, 'asha training': 0, 'asha incentive': 0, 'janani suraksha yojana': 0, 'jsy': 0, 'janani shishu suraksha karyakram': 0, 'pmsma': 0, 'mission indradhanush': 0, 'intensified mission indradhanush': 0, 'poshan abhiyaan': 0, 'pmmvy': 0, 'suman programme': 0, 'suman maternity': 0, 'mcts': 0, 'mamata kit': 0, 'sneha sparsha': 0, 'congenital heart disease scheme': 0, 'operation smile': 0, 'majoni scheme': 0, 'assam free diagnostics': 0, 'national maternity benefit scheme': 0, 'rch': 0}",{},Monsoon,NHM
2024_BTC_38965_1,27/KOJ/NIT/Pt-II/2023-24/121,Construction of Immunization Hall and Repairing of Boundary Wall with Colour of Partabkhata SD at Pratabkhata in Kokrajhar District. TN No.12_04.,Construction of Immunization Hall and Repairing of Boundary Wall with Colour of Partabkhata SD at Pratabkhata in Kokrajhar District. TN No.12_04.,Works,Open Tender,Item Rate,Civil Works - Building,No,No,NA ,13-Sep-2024 10:30 AM,NA ,180.0,No ,No,Online,05-Oct-2024 12:00 PM,Bodoland Territorial Council-PWD||Director Cum CHD - PWD BTC,Kokrajhar,783370.0,2.0,"14,93,194",Biswa Gopal Saha,"1,492,997.31",Accepted-AOC,06-Nov-2024,Bodoland Territorial Council-PWD||Director Cum CHD - PWD BTC,True,"{'maternal': 0, 'maternity': 0, 'mother and child': 0, 'maternity and child health': 0, 'pregnant woman': 0, 'pregnant women': 0, 'pregnancy care': 0, 'institutional delivery': 0, 'labour room': 0, 'labor room': 0, 'labour ward': 0, 'maternity ward': 0, 'newborn': 0, 'neonatal': 0, 'infant': 0, 'nicu': 0, 'sncu': 0, 'child health': 0, 'paediatric': 0, 'pediatric': 0, 'antenatal care': 0, 'antenatal clinic': 0, 'anc check-up': 0, 'anc clinic': 0, 'postnatal care': 0, 'pnc visit': 0, 'immunization': 2, 'immunisation': 0, 'vaccination': 0, 'vaccine': 0, 'cold chain': 0, 'ice lined refrigerator': 0, 'ilr': 0, 'deep freezer': 0, 'vaccine carrier': 0, 'cold box': 0, 'nutrition rehabilitation': 0, 'growth monitoring': 0, 'malnutrition reduction': 0, 'anganwadi centre': 0, 'anganwadi center': 0, 'icds centre': 0, 'icds center': 0, 'jssk': 0, 'samahar kit': 0, 'poshan': 0, 'rbsk': 0, 'rch register': 0, 'rch programme': 0, 'nhm': 0, 'nrhm': 0, 'mamoni': 0, 'asha worker': 0, 'asha training': 0, 'asha incentive': 0, 'janani suraksha yojana': 0, 'jsy': 0, 'janani shishu suraksha karyakram': 0, 'pmsma': 0, 'mission indradhanush': 0, 'intensified mission indradhanush': 0, 'poshan abhiyaan': 0, 'pmmvy': 0, 'suman programme': 0, 'suman maternity': 0, 'mcts': 0, 'mamata kit': 0, 'sneha sparsha': 0, 'congenital heart disease scheme': 0, 'operation smile': 0, 'majoni scheme': 0, 'assam free diagnostics': 0, 'national maternity benefit scheme': 0, 'rch': 0}",{},Monsoon,CHD_SCHEME;UIP
2024_HFWD_38303_1,NHM/GMCH/11/PART-V/260/686,"supply of medicines, surgical items and consumables for the department of Oand G (CS and Normal Delivery) and Pediatrics (NICU and PICU) GMCH, Guwahati 32","supply of medicines, surgical items and consumables for the department of Oand G (CS and Normal Delivery) and Pediatrics (NICU and PICU) GMCH, Guwahati 32",Goods,Open Tender,Item Wise,Medicines,No,No,NA ,01-Aug-2024 05:00 PM,06-Aug-2024 11:30 AM ,365.0,No ,No,Online,27-Aug-2024 04:00 PM,Health and Family Welfare Department||Directorate of Medical Education-HFWD||Guwahati Medical College Hospital-HFWD,"GMCH, Bhangagarh, Guwahati",781032.0,2.0,,SRL Associates,"5,551.82",Accepted-AOC,28-Nov-2024,Health and Family Welfare Department||Directorate of Medical Education-HFWD||Guwahati Medical College Hospital-HFWD,True,"{'maternal': 0, 'maternity': 0, 'mother and child': 0, 'maternity and child health': 0, 'pregnant woman': 0, 'pregnant women': 0, 'pregnancy care': 0, 'institutional delivery': 0, 'labour room': 0, 'labor room': 0, 'labour ward': 0, 'maternity ward': 0, 'newborn': 0, 'neonatal': 0, 'infant': 0, 'nicu': 2, 'sncu': 0, 'child health': 0, 'paediatric': 0, 'pediatric': 0, 'antenatal care': 0, 'antenatal clinic': 0, 'anc check-up': 0, 'anc clinic': 0, 'postnatal care': 0, 'pnc visit': 0, 'immunization': 0, 'immunisation': 0, 'vaccination': 0, 'vaccine': 0, 'cold chain': 0, 'ice lined refrigerator': 0, 'ilr': 0, 'deep freezer': 0, 'vaccine carrier': 0, 'cold box': 0, 'nutrition rehabilitation': 0, 'growth monitoring': 0, 'malnutrition reduction': 0, 'anganwadi centre': 0, 'anganwadi center': 0, 'icds centre': 0, 'icds center': 0, 'jssk': 0, 'samahar kit': 0, 'poshan': 0, 'rbsk': 0, 'rch register': 0, 'rch programme': 0, 'nhm': 1, 'nrhm': 0, 'mamoni': 0, 'asha worker': 0, 'asha training': 0, 'asha incentive': 0, 'janani suraksha yojana': 0, 'jsy': 0, 'janani shishu suraksha karyakram': 0, 'pmsma': 0, 'mission indradhanush': 0, 'intensified mission indradhanush': 0, 'poshan abhiyaan': 0, 'pmmvy': 0, 'suman programme': 0, 'suman maternity': 0, 'mcts': 0, 'mamata kit': 0, 'sneha sparsha': 0, 'congenital heart disease scheme': 0, 'operation smile': 0, 'majoni scheme': 0, 'assam free diagnostics': 0, 'national maternity benefit scheme': 0, 'rch': 0}",{},Monsoon,HFW;NHM
2024_NHM_35729_7,NHM/32031/106/2023-CONS-NHM,Construction of Integrated Public Health Laboratory at HOJAI DISTRICT HOSPITAL in HOJAI District under PM ABHIM for the FY 2023 24 under NHM on Turnkey Basis,Construction of Integrated Public Health Laboratory at HOJAI DISTRICT HOSPITAL in HOJAI District under PM ABHIM for the FY 2023 24 under NHM on Turnkey Basis,Works,Open Tender,Turn-key,Civil Works - Building,No,No,NA ,30-Jan-2024 09:55 AM,NA ,180.0,No ,No,Online,08-Feb-2024 03:30 PM,National Health Mission||State Programme Management Unit - NHM,HOJAI,783385.0,2.0,"1,24,98,241",HEMANTA KALITA,"11,109,686",Accepted-AOC,13-Nov-2024,National Health Mission||State Programme Management Unit - NHM,True,"{'maternal': 0, 'maternity': 0, 'mother and child': 0, 'maternity and child health': 0, 'pregnant woman': 0, 'pregnant women': 0, 'pregnancy care': 0, 'institutional delivery': 0, 'labour room': 0, 'labor room': 0, 'labour ward': 0, 'maternity ward': 0, 'newborn': 0, 'neonatal': 0, 'infant': 0, 'nicu': 0, 'sncu': 0, 'child health': 0, 'paediatric': 0, 'pediatric': 0, 'antenatal care': 0, 'antenatal clinic': 0, 'anc check-up': 0, 'anc clinic': 0, 'postnatal care': 0, 'pnc visit': 0, 'immunization': 0, 'immunisation': 0, 'vaccination': 0, 'vaccine': 0, 'cold chain': 0, 'ice lined refrigerator': 0, 'ilr': 0, 'deep freezer': 0, 'vaccine carrier': 0, 'cold box': 0, 'nutrition rehabilitation': 0, 'growth monitoring': 0, 'malnutrition reduction': 0, 'anganwadi centre': 0, 'anganwadi center': 0, 'icds centre': 0, 'icds center': 0, 'jssk': 0, 'samahar kit': 0, 'poshan': 0, 'rbsk': 0, 'rch register': 0, 'rch programme': 0, 'nhm': 4, 'nrhm': 0, 'mamoni': 0, 'asha worker': 0, 'asha training': 0, 'asha incentive': 0, 'janani suraksha yojana': 0, 'jsy': 0, 'janani shishu suraksha karyakram': 0, 'pmsma': 0, 'mission indradhanush': 0, 'intensified mission indradhanush': 0, 'poshan abhiyaan': 0, 'pmmvy': 0, 'suman programme': 0, 'suman maternity': 0, 'mcts': 0, 'mamata kit': 0, 'sneha sparsha': 0, 'congenital heart disease scheme': 0, 'operation smile': 0, 'majoni scheme': 0, 'assam free diagnostics': 0, 'national maternity benefit scheme': 0, 'rch': 0}",{},Pre-Monsoon,NHM
2024_PWD_39718_1,SE/MRC/TB/NIT/01/2023-24/17,Package No.MRC/TAC/2024-25/06 (Gr-V),1.Molbor Patar house to Amtolighat road at Bormanipur 2.Fuleswar Bordoloi house to Bormanipur Anganwadi Centre 3.1 No. Manipur M.E. School to L.P. School 4.Kushal Bordoloi house to Ashok Patar house,Works,Open Tender,Item Rate,Civil Works – Roads,No,No,NA ,07-Oct-2024 10:00 AM,NA ,180.0,No ,No,Online,16-Oct-2024 10:00 AM,Public Works Roads Department||CE PWD(R) - PWD,Morigaon,782105.0,2.0,"96,27,000",MS MEDHI ENTERPRISE,"9,625,000",Accepted-AOC,30-Nov-2024,Public Works Roads Department||CE PWD(R) - PWD,True,"{'maternal': 0, 'maternity': 0, 'mother and child': 0, 'maternity and child health': 0, 'pregnant woman': 0, 'pregnant women': 0, 'pregnancy care': 0, 'institutional delivery': 0, 'labour room': 0, 'labor room': 0, 'labour ward': 0, 'maternity ward': 0, 'newborn': 0, 'neonatal': 0, 'infant': 0, 'nicu': 0, 'sncu': 0, 'child health': 0, 'paediatric': 0, 'pediatric': 0, 'antenatal care': 0, 'antenatal clinic': 0, 'anc check-up': 0, 'anc clinic': 0, 'postnatal care': 0, 'pnc visit': 0, 'immunization': 0, 'immunisation': 0, 'vaccination': 0, 'vaccine': 0, 'cold chain': 0, 'ice lined refrigerator': 0, 'ilr': 0, 'deep freezer': 0, 'vaccine carrier': 0, 'cold box': 0, 'nutrition rehabilitation': 0, 'growth monitoring': 0, 'malnutrition reduction': 0, 'anganwadi centre': 1, 'anganwadi center': 0, 'icds centre': 0, 'icds center': 0, 'jssk': 0, 'samahar kit': 0, 'poshan': 0, 'rbsk': 0, 'rch register': 0, 'rch programme': 0, 'nhm': 0, 'nrhm': 0, 'mamoni': 0, 'asha worker': 0, 'asha training': 0, 'asha incentive': 0, 'janani suraksha yojana': 0, 'jsy': 0, 'janani shishu suraksha karyakram': 0, 'pmsma': 0, 'mission indradhanush': 0, 'intensified mission indradhanush': 0, 'poshan abhiyaan': 0, 'pmmvy': 0, 'suman programme': 0, 'suman maternity': 0, 'mcts': 0, 'mamata kit': 0, 'sneha sparsha': 0, 'congenital heart disease scheme': 0, 'operation smile': 0, 'majoni scheme': 0, 'assam free diagnostics': 0, 'national maternity benefit scheme': 0, 'rch': 0}",{},Monsoon,
