Tender ID,tender_externalreference,tender_title,Work Description,Tender Category,Tender Type,Form of contract,Product Category,Is Multi Currency Allowed For BOQ,Allow Two Stage Bidding,Independent External Monitor/Remarks,Published Date,Pre Bid Meeting Date,Bid Validity(Days),Should Allow NDA Tender,Allow Preferential Bidder,Payment Mode,Bid Opening Date,Organisation Chain,location,Pincode,No of Bids Received,Tender Value in ₹,Bidder Name,Awarded Value,Status,Contract Date :,Department,is_mch_tender,positive_keywords_dict,negative_keywords_dict,Season,Scheme
2023_NHM_29826_37,NHM-32031/4/2021-Const-NHM/Pt 34/69,Establishment of Proposed 6 bedded ward at various SHCs and PHCs of Assam under ECRP-II NHM Assam Group 66 6 nos schemes in Dhubri district,Establishment of Proposed 6 bedded ward at various SHCs and PHCs of Assam under ECRP-II NHM Assam Group 66 6 nos schemes in Dhubri district,Works,Open Tender,Turn-key,Civil Works - Building,No,No,NA ,13-Mar-2023 04:30 PM,NA ,180.0,No ,No,Online,10-Apr-2023 03:00 PM,National Health Mission||State Programme Management Unit - NHM,Dhubri,783301.0,2.0,"69,59,742",Santosh Kr. Harlalka,"6,959,700",Accepted-AOC,09-Dec-2024,National Health Mission||State Programme Management Unit - NHM,True,"{'maternal': 0, 'maternity': 0, 'mother and child': 0, 'maternity and child health': 0, 'pregnant woman': 0, 'pregnant women': 0, 'pregnancy care': 0, 'institutional delivery': 0, 'labour room': 0, 'labor room': 0, 'labour ward': 0, 'maternity ward': 0, 'newborn': 0, 'neonatal': 0, 'infant': 0, 'nicu': 0, 'sncu': 0, 'child health': 0, 'paediatric': 0, 'pediatric': 0, 'antenatal care': 0, 'antenatal clinic': 0, 'anc check-up': 0, 'anc clinic': 0, 'postnatal care': 0, 'pnc visit': 0, 'immunization': 0, 'immunisation': 0, 'vaccination': 0, 'vaccine': 0, 'cold chain': 0, 'ice lined refrigerator': 0, 'ilr': 0, 'deep freezer': 0, 'vaccine carrier': 0, 'cold box': 0, 'nutrition rehabilitation': 0, 'growth monitoring': 0, 'malnutrition reduction': 0, 'anganwadi centre': 0, 'anganwadi center': 0, 'icds centre': 0, 'icds center': 0, 'jssk': 0, 'samahar kit': 0, 'poshan': 0, 'rbsk': 0, 'rch register': 0, 'rch programme': 0, 'nhm': 4, 'nrhm': 0, 'mamoni': 0, 'asha worker': 0, 'asha training': 0, 'asha incentive': 0, 'janani suraksha yojana': 0, 'jsy': 0, 'janani shishu suraksha karyakram': 0, 'pmsma': 0, 'mission indradhanush': 0, 'intensified mission indradhanush': 0, 'poshan abhiyaan': 0, 'pmmvy': 0, 'suman programme': 0, 'suman maternity': 0, 'mcts': 0, 'mamata kit': 0, 'sneha sparsha': 0, 'congenital heart disease scheme': 0, 'operation smile': 0, 'majoni scheme': 0, 'assam free diagnostics': 0, 'national maternity benefit scheme': 0, 'rch': 0}",{},Pre-Monsoon,NHM
2023_NHM_31705_17,NHM-32050/46/2021 Construction NHM 89,Repairing Renovation of 229 Nos of Sub Centre to upgrade them as Health n Wellness Centre at various places of Assam under NHM Assam Group 9 5 nos schemes in Lakhimpur district,Repairing Renovation of 229 Nos of Sub Centre to upgrade them as Health n Wellness Centre at various places of Assam under NHM Assam Group 9 5 nos schemes in Lakhimpur district,Works,Open Tender,Item Rate,Civil Works - Building,No,No,NA ,19-Jul-2023 01:00 PM,NA ,180.0,No ,No,Online,01-Aug-2023 03:30 PM,National Health Mission||State Programme Management Unit - NHM,Lakhimpur District,787001.0,2.0,"34,94,448",Chakra Bharali,"2,830,575.39",Accepted-AOC,09-Dec-2024,National Health Mission||State Programme Management Unit - NHM,True,"{'maternal': 0, 'maternity': 0, 'mother and child': 0, 'maternity and child health': 0, 'pregnant woman': 0, 'pregnant women': 0, 'pregnancy care': 0, 'institutional delivery': 0, 'labour room': 0, 'labor room': 0, 'labour ward': 0, 'maternity ward': 0, 'newborn': 0, 'neonatal': 0, 'infant': 0, 'nicu': 0, 'sncu': 0, 'child health': 0, 'paediatric': 0, 'pediatric': 0, 'antenatal care': 0, 'antenatal clinic': 0, 'anc check-up': 0, 'anc clinic': 0, 'postnatal care': 0, 'pnc visit': 0, 'immunization': 0, 'immunisation': 0, 'vaccination': 0, 'vaccine': 0, 'cold chain': 0, 'ice lined refrigerator': 0, 'ilr': 0, 'deep freezer': 0, 'vaccine carrier': 0, 'cold box': 0, 'nutrition rehabilitation': 0, 'growth monitoring': 0, 'malnutrition reduction': 0, 'anganwadi centre': 0, 'anganwadi center': 0, 'icds centre': 0, 'icds center': 0, 'jssk': 0, 'samahar kit': 0, 'poshan': 0, 'rbsk': 0, 'rch register': 0, 'rch programme': 0, 'nhm': 4, 'nrhm': 0, 'mamoni': 0, 'asha worker': 0, 'asha training': 0, 'asha incentive': 0, 'janani suraksha yojana': 0, 'jsy': 0, 'janani shishu suraksha karyakram': 0, 'pmsma': 0, 'mission indradhanush': 0, 'intensified mission indradhanush': 0, 'poshan abhiyaan': 0, 'pmmvy': 0, 'suman programme': 0, 'suman maternity': 0, 'mcts': 0, 'mamata kit': 0, 'sneha sparsha': 0, 'congenital heart disease scheme': 0, 'operation smile': 0, 'majoni scheme': 0, 'assam free diagnostics': 0, 'national maternity benefit scheme': 0, 'rch': 0}",{},Monsoon,NHM
2024_NHM_35729_6,NHM/32031/106/2023-CONS-NHM,Construction of Integrated Public Health Laboratory at MORIGAON CIVIL HOSPITAL in MORIGAON District under PM ABHIM for the FY 2023 24 under NHM on Turnkey Basis,Construction of Integrated Public Health Laboratory at MORIGAON CIVIL HOSPITAL in MORIGAON District under PM ABHIM for the FY 2023 24 under NHM on Turnkey Basis,Works,Open Tender,Turn-key,Civil Works - Building,No,No,NA ,29-Jan-2024 06:55 PM,NA ,180.0,No ,No,Online,08-Feb-2024 03:30 PM,National Health Mission||State Programme Management Unit - NHM,MORIGAON,783385.0,2.0,"1,24,98,241",Biren Deka,"10,967,200",Accepted-AOC,24-Dec-2024,National Health Mission||State Programme Management Unit - NHM,True,"{'maternal': 0, 'maternity': 0, 'mother and child': 0, 'maternity and child health': 0, 'pregnant woman': 0, 'pregnant women': 0, 'pregnancy care': 0, 'institutional delivery': 0, 'labour room': 0, 'labor room': 0, 'labour ward': 0, 'maternity ward': 0, 'newborn': 0, 'neonatal': 0, 'infant': 0, 'nicu': 0, 'sncu': 0, 'child health': 0, 'paediatric': 0, 'pediatric': 0, 'antenatal care': 0, 'antenatal clinic': 0, 'anc check-up': 0, 'anc clinic': 0, 'postnatal care': 0, 'pnc visit': 0, 'immunization': 0, 'immunisation': 0, 'vaccination': 0, 'vaccine': 0, 'cold chain': 0, 'ice lined refrigerator': 0, 'ilr': 0, 'deep freezer': 0, 'vaccine carrier': 0, 'cold box': 0, 'nutrition rehabilitation': 0, 'growth monitoring': 0, 'malnutrition reduction': 0, 'anganwadi centre': 0, 'anganwadi center': 0, 'icds centre': 0, 'icds center': 0, 'jssk': 0, 'samahar kit': 0, 'poshan': 0, 'rbsk': 0, 'rch register': 0, 'rch programme': 0, 'nhm': 4, 'nrhm': 0, 'mamoni': 0, 'asha worker': 0, 'asha training': 0, 'asha incentive': 0, 'janani suraksha yojana': 0, 'jsy': 0, 'janani shishu suraksha karyakram': 0, 'pmsma': 0, 'mission indradhanush': 0, 'intensified mission indradhanush': 0, 'poshan abhiyaan': 0, 'pmmvy': 0, 'suman programme': 0, 'suman maternity': 0, 'mcts': 0, 'mamata kit': 0, 'sneha sparsha': 0, 'congenital heart disease scheme': 0, 'operation smile': 0, 'majoni scheme': 0, 'assam free diagnostics': 0, 'national maternity benefit scheme': 0, 'rch': 0}",{},Pre-Monsoon,NHM
2024_NHM_38329_19,NHM-32049/2/2024-CONS,"Construction of BPHU at Srijangram BPHC cum Model Hospital and Lengtisinga MPHC in Bongaigaon District under PM ABHIM for the FY 2025-26 under NHM, Assam on Turnkey Basis Group no-5 (2 nos. of Scheme in Bongaigaon District)","Construction of BPHU at Srijangram BPHC cum Model Hospital and Lengtisinga MPHC in Bongaigaon District under PM ABHIM for the FY 2025-26 under NHM, Assam on Turnkey Basis Group no-5 (2 nos. of Scheme in Bongaigaon District)",Works,Open Tender,Turn-key,Civil Works - Building,No,No,NA ,07-Aug-2024 06:55 PM,NA ,180.0,No ,No,Online,20-Aug-2024 03:30 PM,National Health Mission||State Programme Management Unit - NHM,Bongaigaon,783380.0,2.0,"1,00,00,000",Chanmahmud Ali,"8,450,000",Accepted-AOC,24-Dec-2024,National Health Mission||State Programme Management Unit - NHM,True,"{'maternal': 0, 'maternity': 0, 'mother and child': 0, 'maternity and child health': 0, 'pregnant woman': 0, 'pregnant women': 0, 'pregnancy care': 0, 'institutional delivery': 0, 'labour room': 0, 'labor room': 0, 'labour ward': 0, 'maternity ward': 0, 'newborn': 0, 'neonatal': 0, 'infant': 0, 'nicu': 0, 'sncu': 0, 'child health': 0, 'paediatric': 0, 'pediatric': 0, 'antenatal care': 0, 'antenatal clinic': 0, 'anc check-up': 0, 'anc clinic': 0, 'postnatal care': 0, 'pnc visit': 0, 'immunization': 0, 'immunisation': 0, 'vaccination': 0, 'vaccine': 0, 'cold chain': 0, 'ice lined refrigerator': 0, 'ilr': 0, 'deep freezer': 0, 'vaccine carrier': 0, 'cold box': 0, 'nutrition rehabilitation': 0, 'growth monitoring': 0, 'malnutrition reduction': 0, 'anganwadi centre': 0, 'anganwadi center': 0, 'icds centre': 0, 'icds center': 0, 'jssk': 0, 'samahar kit': 0, 'poshan': 0, 'rbsk': 0, 'rch register': 0, 'rch programme': 0, 'nhm': 3, 'nrhm': 0, 'mamoni': 0, 'asha worker': 0, 'asha training': 0, 'asha incentive': 0, 'janani suraksha yojana': 0, 'jsy': 0, 'janani shishu suraksha karyakram': 0, 'pmsma': 0, 'mission indradhanush': 0, 'intensified mission indradhanush': 0, 'poshan abhiyaan': 0, 'pmmvy': 0, 'suman programme': 0, 'suman maternity': 0, 'mcts': 0, 'mamata kit': 0, 'sneha sparsha': 0, 'congenital heart disease scheme': 0, 'operation smile': 0, 'majoni scheme': 0, 'assam free diagnostics': 0, 'national maternity benefit scheme': 0, 'rch': 0}",{},Monsoon,NHM
2024_NHM_38621_1,NHM/ECF/139303,Construction of Proposed Boys Hostel G2 at Diphu Medical College and Hospital Diphu Karbi Anglong under NHM Assam on Turn Key Basis,Construction of Proposed Boys Hostel G2 at Diphu Medical College and Hospital Diphu Karbi Anglong under NHM Assam on Turn Key Basis,Works,Open Tender,Turn-key,Civil Works - Building,No,No,NA ,23-Aug-2024 09:00 AM,NA ,180.0,No ,No,Online,13-Sep-2024 03:30 PM,National Health Mission||State Programme Management Unit - NHM,Diphu,782460.0,2.0,"4,04,76,982",biswajit banik,"34,931,635",Accepted-AOC,19-Dec-2024,National Health Mission||State Programme Management Unit - NHM,True,"{'maternal': 0, 'maternity': 0, 'mother and child': 0, 'maternity and child health': 0, 'pregnant woman': 0, 'pregnant women': 0, 'pregnancy care': 0, 'institutional delivery': 0, 'labour room': 0, 'labor room': 0, 'labour ward': 0, 'maternity ward': 0, 'newborn': 0, 'neonatal': 0, 'infant': 0, 'nicu': 0, 'sncu': 0, 'child health': 0, 'paediatric': 0, 'pediatric': 0, 'antenatal care': 0, 'antenatal clinic': 0, 'anc check-up': 0, 'anc clinic': 0, 'postnatal care': 0, 'pnc visit': 0, 'immunization': 0, 'immunisation': 0, 'vaccination': 0, 'vaccine': 0, 'cold chain': 0, 'ice lined refrigerator': 0, 'ilr': 0, 'deep freezer': 0, 'vaccine carrier': 0, 'cold box': 0, 'nutrition rehabilitation': 0, 'growth monitoring': 0, 'malnutrition reduction': 0, 'anganwadi centre': 0, 'anganwadi center': 0, 'icds centre': 0, 'icds center': 0, 'jssk': 0, 'samahar kit': 0, 'poshan': 0, 'rbsk': 0, 'rch register': 0, 'rch programme': 0, 'nhm': 3, 'nrhm': 0, 'mamoni': 0, 'asha worker': 0, 'asha training': 0, 'asha incentive': 0, 'janani suraksha yojana': 0, 'jsy': 0, 'janani shishu suraksha karyakram': 0, 'pmsma': 0, 'mission indradhanush': 0, 'intensified mission indradhanush': 0, 'poshan abhiyaan': 0, 'pmmvy': 0, 'suman programme': 0, 'suman maternity': 0, 'mcts': 0, 'mamata kit': 0, 'sneha sparsha': 0, 'congenital heart disease scheme': 0, 'operation smile': 0, 'majoni scheme': 0, 'assam free diagnostics': 0, 'national maternity benefit scheme': 0, 'rch': 0}",{},Monsoon,NHM
